CardId,RuleFamily,RuleCategory,Trigger,Base,WordCategory,Before,After,Answer,Outcome,Why
c000001,"Soft, Contact",Adjective+Noun,trefn,penodol,adj,Mae trefn,ar gyfer rheoli diogelwch,benodol,SM,"After a feminine singular noun, the following adjective softens (ll/rh don’t change): penodol → benodol."
c000002,"Soft, Contact",Adjective+Noun,ardal,preswyl,adj,Mae’r ardal,hon yn dawel.,breswyl,SM,"Adjective after a feminine singular noun softens: p → b, hence ardal breswyl."
c000003,"Soft, Contact",Adjective+Noun,gêm,mawr,adj,Sgorion nhw yn y gêm,,fawr,SM,A feminine singular noun before an adjective makes it soften: mawr → fawr after gêm.
c000004,"Soft, Contact",Article,y,cynulleidfa,noun-fem,Roedd y,yn frwdfrydig.,gynulleidfa,SM,Feminine singular nouns soften after the definite article: c → g (y gynulleidfa).
c000005,"Soft, Contact",Article,y,gwasg,noun-fem,Cyhoeddwyd y llyfr gan y,,wasg,SM,Feminine singular after y; initial g drops under soft mutation (y wasg).
c000006,"Soft, Contact",Article,y,deddf,noun-fem,Pasiodd y,yn 2020.,ddeddf,SM,Feminine singular after y: d → dd (y ddeddf).
c000007,"Soft, Contact",Article,y,masnach,noun-fem,Mae’r,ryngwladol yn tyfu.,fasnach,SM,Feminine singular after y: m → f (y fasnach).
c000008,None,Article,y,senedd,noun-fem,Mae’r,yn cyfarfod heddiw.,senedd,NONE,s does not soften; the article doesn’t change it (y senedd).
c000009,None,Article,yr,amrywiaeth,noun-fem,Mae’r,o opsiynau yn eang.,amrywiaeth,NONE,Vowel-initial nouns show no change; the article is yr before vowels (yr amrywiaeth).
c000010,None,Article,yr,ymgyrch,noun-fem,Siaradwyd am yr,newydd.,ymgyrch,NONE,Vowel-initial; no soft mutation of vowels (yr ymgyrch).
c000011,"Soft, Contact",Article,y,gwefan,noun-fem,Darllenais i’r erthygl ar y,swyddogol.,wefan,SM,Feminine singular after y: g → ∅ (y wefan).
c000012,"Soft, Contact",Article,y,mam,noun-fem,Mae’r,yn gweithio yn yr ysbyty.,fam,SM,Feminine singular after y: m → f (y fam).
c000013,"Soft, Contact",Article,y,taith,noun-fem,Mae’r trên yn aros ar y,nesaf.,daith,SM,Feminine singular after y: t → d (y daith).
c000014,"Soft, Contact",Article,y,merch,noun-fem,Dyma’r,sy’n arwain y prosiect.,ferch,SM,Feminine singular after y: m → f (y ferch).
c000015,"Soft, Contact",Article,y,cerddoriaeth,noun-fem,Roedd y,yn fyw a phwerus.,gerddoriaeth,SM,Feminine singular after y: c → g.
c000016,"Soft, Contact",Article,y,cyfres,noun-fem,A yw’r,newydd yn dechrau heno?,gyfres,SM,Feminine singular after y: c → g.
c000017,"Soft, Contact",Article,y,cymdeithas,noun-fem,Mae’r,yn cynnal cyfarfod blynyddol.,gymdeithas,SM,Feminine singular after y: c → g.
c000018,"Soft, Contact",Article,y,problem,noun-fem,Sut y gallwn ni ddatrys y,hon?,broblem,SM,Feminine singular after y: p → b.
c000019,"Soft, Contact",Article,y,prifysgol,noun-fem,Mae’r,yn agos at y ddinas.,brifysgol,SM,Feminine singular after y: p → b.
c000020,"Soft, Contact",Article,y,cymuned,noun-fem,Mae’r,yn gryf iawn yma.,gymuned,SM,Feminine singular after y: c → g.
c000021,"Soft, Contact",Article,y,canolfan,noun-fem,Mae’r bws yn stopio ger y,,ganolfan,SM,Feminine singular after y: c → g.
c000022,"Soft, Contact",Article,y,canrif,noun-fem,Yn y,diwethaf gwelwyd newidiadau mawr.,ganrif,SM,Feminine singular after y: c → g.
c000023,"Soft, Contact",Numerals,un,blwyddyn,noun-fem,Dyna un,yn unig.,flwyddyn,SM,Un before a feminine noun softens it.
c000024,"Soft, Contact",Numerals,dwy,blynedd,noun-fem,Arhoson ni yno am dwy,,flynedd,SM,Dwy causes soft mutation; the time-word shows its special form ‘blynedd’.
c000025,None,Numerals,tair,blynedd,noun-fem,Mae’r cwrs yn para tair,,blynedd,NONE,No softening after tair in this time pattern.
c000026,None,Numerals,pedair,blynedd,noun-fem,Bydd y les yn para pedair,,blynedd,NONE,No softening after pedair.
c000027,"Nasal, Contact",Numerals,pum,blynedd,noun-fem,Buon nhw yno am bum,,mlynedd,NM,5–10 cause nasal mutation with ‘blynedd’: b → m (mlynedd).
c000028,"Nasal, Contact",Numerals,chwe,blynedd,noun-fem,Cafodd y cynllun ei ohirio am chwe,,mlynedd,NM,Chwe takes the NM pattern with blynedd.
c000029,"Nasal, Contact",Numerals,saith,blynedd,noun-fem,Ar ôl saith,,mlynedd,NM,Saith gives NM before blynedd.
c000030,"Nasal, Contact",Numerals,wyth,blynedd,noun-fem,Roedden nhw’n briod ers wyth,,mlynedd,NM,Wyth gives NM before blynedd.
c000031,"Nasal, Contact",Numerals,naw,blynedd,noun-fem,Buodd y prosiect yn rhedeg am naw,,mlynedd,NM,Naw gives NM before blynedd.
c000032,"Nasal, Contact",Numerals,deg,blynedd,noun-fem,Roedd y contract yn ddilys am deng,,mlynedd,NM,"Deg appears as deng before m-, and blynedd shows NM → mlynedd."
c000033,"Nasal, Contact",Numerals,deuddeg,blynedd,noun-fem,Symudon nhw ar ôl deuddeg,,mlynedd,NM,Deuddeg follows the same NM pattern with blynedd.
c000034,"Nasal, Contact",Numerals,pymtheg,blynedd,noun-fem,Aroson ni am bymtheg,cyn newid gwaith.,mlynedd,NM,Pymtheg gives NM with blynedd.
c000035,"Nasal, Contact",Numerals,deunaw,blynedd,noun-fem,Cafodd y cwmni ei werthu ar ôl deunaw,,mlynedd,NM,Deunaw gives NM with blynedd.
c000036,"Nasal, Contact",Numerals,ugain,blynedd,noun-fem,Bywodd y teulu dramor am ugain,,mlynedd,NM,Ugain + blynedd → NM (mlynedd).
c000037,"Nasal, Contact",Numerals,deugain,blynedd,noun-fem,Rhys gafodd seibiant o ddeugain,,mlynedd,NM,Deugain + blynedd → NM (mlynedd).
c000038,"Nasal, Contact",Numerals,can,blynedd,noun-fem,Mae’r bont yn sefyll ers can,,mlynedd,NM,Can + blynedd → NM (mlynedd).
c000039,"Nasal, Contact",Numerals,pum,blynedd,noun-fem,Prynwyd y tŷ pum,ar hugain yn ôl.,mlynedd,NM,"In compound numbers with ‘ar’, the noun before ‘ar’ shows NM: pum mlynedd ar hugain."
c000040,"Soft, Contact",Numerals,dau,cwmni,noun-masc,Cawsom gynnig gan dau,,gwmni,SM,Dau softens a following masculine noun: c → g.
c000041,"Soft, Contact",Numerals,dau,teulu,noun-masc,Mae dau,yn byw yn y tŷ mawr.,deulu,SM,Dau softens: t → d.
c000042,"Soft, Contact",Numerals,dau,cynllun,noun-masc,Cyflwynwyd dau,i’r pwyllgor.,gynllun,SM,Dau softens: c → g.
c000043,"Soft, Contact",Numerals,dau,dyn,noun-masc,Gwelon ni dau,yn aros wrth y drws.,ddyn,SM,Dau softens: d → dd.
c000044,"Soft, Contact",Numerals,dau,mudiad,noun-masc,Mae dau,yn cefnogi’r achos.,fudiad,SM,Dau softens: m → f.
c000045,"Soft, Contact",Numerals,dau,tîm,noun-masc,Gêm rhwng dau,,dîm,SM,Dau softens: t → d.
c000046,"Soft, Contact",Numerals,dau,polisi,noun-masc,Cawsom dau,newydd gan y cwmni.,bolisi,SM,Dau softens: p → b.
c000047,"Soft, Contact",Numerals,dau,cyfrwng,noun-masc,Dewison nhw dau,cyfathrebu.,gyfrwng,SM,Dau softens: c → g.
c000048,"Soft, Contact",Numerals,dau,cwestiwn,noun-masc,Atebais dau,yn ystod y drafodaeth.,gwestiwn,SM,Dau softens: c → g.
c000049,"Soft, Contact",Numerals,dau,bore,noun-masc,Cawsom gyfarfodydd dau,yn olynol.,fore,SM,dau + masculine noun → Soft Mutation. b→f: bore → fore.
c000050,"Soft, Contact",Numerals,dau,cynnig,noun-masc,Daeth dau,ar gyfer y swydd.,gynnig,SM,dau softens c→g: cynnig → gynnig.
c000051,"Soft, Contact",Numerals,dau,cofnod,noun-masc,Cedwir dau,ar y system.,gofnod,SM,dau softens c→g: cofnod → gofnod.
c000052,"Soft, Contact",Numerals,dau,cyfarfod,noun-masc,Mae dau,wedi’u trefnu bore yma.,gyfarfod,SM,dau softens c→g: cyfarfod → gyfarfod.
c000053,"Soft, Contact",Numerals,dau,digwyddiad,noun-masc,Cafodd dau,eu gohirio.,ddigwyddiad,SM,dau softens d→dd: digwyddiad → ddigwyddiad.
c000054,"Soft, Contact",Numerals,dau,dewis,noun-masc,Roedden ni’n cael dau,yn y ffurflen.,ddewis,SM,dau softens d→dd: dewis → ddewis.
c000055,"Soft, Contact",Numerals,dau,prosiect,noun-masc,Mae’r adran yn rhedeg dau,eleni.,brosiect,SM,dau softens p→b: prosiect → brosiect.
c000056,"Soft, Contact",Numerals,dau,grŵp,noun-masc,Mae’r dosbarth wedi’i rannu’n dau,.,rŵp,SM,dau softens g→∅: grŵp → rŵp (g drops).
c000057,"Soft, Contact",Numerals,dau,papur,noun-masc,Mae gen i dau,i’w argraffu.,bapur,SM,dau softens p→b: papur → bapur.
c000058,"Soft, Contact",Numerals,dau,clwb,noun-masc,Mae dau,pêl-droed yn y dref.,glwb,SM,dau softens c→g: clwb → glwb.
c000059,"Soft, Contact",Numerals,dau,dosbarth,noun-masc,Rydyn ni’n rhedeg dau,bob prynhawn.,ddosbarth,SM,dau softens d→dd: dosbarth → ddosbarth.
c000060,"Soft, Contact",Numerals,dau,tad,noun-masc,Mae ganddi dau,(un biolegol ac un cam).,dad,SM,dau softens t→d: tad → dad.
c000061,"Nasal, Contact",Possessive,fy,pwyllgor,noun-masc,Dyma fy,i.,mhwyllgor,NM,"fy ‘my’ causes Nasal Mutation on p/t/c: p→mh, so pwyllgor → mhwyllgor (fy mhwyllgor i)."
c000062,"Soft, Contact",Possessive,dy,pwyllgor,noun-masc,Pryd yw dy,di’n cyfarfod?,bwyllgor,SM,"dy ‘your (sg.)’ triggers Soft Mutation: p→b, so pwyllgor → bwyllgor."
c000063,"Soft, Contact",Possessive,ei,pwyllgor,noun-masc,Cyhoeddodd ef restr ei,.,bwyllgor,SM,ei meaning ‘his’ causes Soft Mutation: p→b (ei bwyllgor ef). NB: ei ‘her’ behaves differently (aspirate).
c000064,"Aspirate, Contact",Possessive,ei,arian,noun-masc,Roedd hi’n aros am ei,hi.,harian,AM,ei meaning ‘her’ causes Aspirate Mutation; add h- with a-: arian → harian (ei harian hi).
c000065,None,Possessive,eich,pwyllgor,noun-masc,Faint o waith sydd ar eich,chi?,pwyllgor,NONE,No mutation after eich in the standard language (eich pwyllgor chi).
c000066,"Nasal, Contact",Possessive,fy,comisiynydd,noun-masc,Dyma fy,i heddiw.,nghomisiynydd,NM,fy causes Nasal Mutation c→ngh: comisiynydd → nghomisiynydd.
c000067,"Soft, Contact",Possessive,dy,comisiynydd,noun-masc,Dyma dy,di.,gomisiynydd,SM,dy triggers Soft Mutation c→g: comisiynydd → gomisiynydd.
c000068,"Aspirate, Contact",Possessive,ei,comisiynydd,noun-masc,Dyma ei,hi.,chomisiynydd,AM,ei ‘her’ triggers Aspirate Mutation c→ch: comisiynydd → chomisiynydd.
c000069,"Soft, Contact",Possessive,ei,comisiynydd,noun-masc,Dyma ei,ef.,gomisiynydd,SM,ei ‘his’ triggers Soft Mutation c→g: comisiynydd → gomisiynydd.
c000070,"Aspirate, Contact",Possessive,ei,cynulleidfa,noun-fem,Cafodd hi gefnogaeth ei,.,chynulleidfa,AM,ei ‘her’ → Aspirate Mutation c→ch: cynulleidfa → chynulleidfa.
c000071,"Soft, Contact",Possessive,ei,cynulleidfa,noun-fem,Cafodd ef gefnogaeth ei,.,gynulleidfa,SM,ei ‘his’ → Soft Mutation c→g: cynulleidfa → gynulleidfa.
c000072,"Nasal, Contact",Possessive,fy,gwasg,noun-fem,Mae gen i brofiad yn fy,.,ngwasg,NM,fy causes Nasal Mutation g→ng: gwasg → ngwasg.
c000073,"Soft, Contact",Possessive,dy,gwasg,noun-fem,Rwyt ti’n rhedeg dy,di?,wasg,SM,dy triggers SM; initial g disappears under SM: gwasg → wasg.
c000074,"Soft, Contact",Possessive,ei,gwasg,noun-fem,Dyna ei,ef yn y dref.,wasg,SM,ei ‘his’ + g-: g drops in SM → wasg (ei wasg ef).
c000075,None,Possessive,eu,deddf,noun-fem,Cyhoeddwyd testun eu,nhw.,deddf,NONE,eu ‘their’ does not mutate in the standard system.
c000076,None,Possessive,dy,senedd,noun-fem,Dyma dy,di.,senedd,NONE,s is immune to Soft Mutation; no change after dy (dy senedd di).
c000077,None,Possessive,eu,mynediad,noun-masc,Diweddarwyd y manylion am eu,nhw.,mynediad,NONE,eu ‘their’ doesn’t mutate; optional h- only before vowels (not relevant here).
c000078,"Soft, Contact",Preposition,o,tanseilio,verb-noun,Ac o gofio’r peryglon o,hyder mewn cig.,danseilio,SM,"Preposition o causes Soft Mutation on the next word: t→d, tanseilio → danseilio."
c000079,"Soft, Contact",Preposition,o,bywyd,noun-masc,Does dim llawer o,eleni.,fywyd,SM,o softens b→f: bywyd → fywyd.
c000080,"Soft, Contact",Preposition,o,cig,noun-masc,Mae’r cawl yn cynnwys llawer o,.,gig,SM,o softens c→g: cig → gig.
c000081,"Soft, Contact",Preposition,o,pryd,noun-masc,Rydyn ni’n cwrdd o,i’w gilydd.,bryd,SM,o softens p→b: pryd → bryd (o bryd i’w gilydd).
c000082,"Soft, Contact",Preposition,o,tu,noun-masc,Rydyn ni o,’r tîm lleol.,du,SM,o softens t→d: tu → du (o du’r tîm ‘on the side of the team’).
c000083,"Soft, Contact",Preposition,o,diwedd,noun-masc,Mae’r rheolau’n weithredol o,y flwyddyn.,ddiwedd,SM,o softens d→dd: diwedd → ddiwedd.
c000084,"Soft, Contact",Preposition,o,dechrau,noun-masc,Newidiwyd y rheolau o,’r tymor.,ddechrau,SM,o softens d→dd: dechrau → ddechrau.
c000085,"Soft, Contact",Preposition,o,cyngor,noun-masc,Mae angen rhywfaint o,arnom ni.,gyngor,SM,o softens c→g: cyngor → gyngor.
c000086,"Soft, Contact",Preposition,o,bwyd,noun-masc,Mae angen prynu mwy o,cyn y penwythnos.,fwyd,SM,o softens b→f: bwyd → fwyd.
c000087,"Soft, Contact",Preposition,o,busnes,noun-masc,Dw i ddim eisiau trafod pethau o,yn gyhoeddus.,fusnes,SM,o softens b→f: busnes → fusnes.
c000088,"Soft, Contact",Preposition,o,maes,noun-masc,Mae hwn yn rhan o,ymchwil diddorol.,faes,SM,o softens m→f: maes → faes.
c000089,None,Preposition,o,digon,noun-masc,Doedden ni ddim yn cael,o amser.,digon,NONE,"In the pattern digon o …, nothing happens to digon; it’s the noun after o that may mutate."
c000090,"Soft, Contact",Preposition,o,duw,noun-masc,O,! Gobeithio nad yw’n wir.,Dduw,SM,"Vocative/exclamation with o gives SM: d→dd, Duw → Dduw."
c000091,"Soft, Contact",Preposition,o,canol,noun-masc,Daeth y sŵn o,ganol y ddinas.,ganol,SM,o softens c→g: canol → ganol (o ganol y ddinas).
c000092,"Soft, Contact",Preposition,o,profiad,noun-masc,Dw i’n siarad o,personol.,brofiad,SM,o softens p→b: profiad → brofiad (o brofiad personol).
c000093,"Soft, Contact",Preposition,o,cartref,noun-masc,Maen nhw’n gweithio o,ddwywaith yr wythnos.,gartref,SM,o softens c→g: cartref → gartref.
c000094,"Soft, Contact",Preposition,o,gogledd,noun-masc,Daethon nhw o,Gymru.,ogledd,SM,With g- the g disappears under SM: gogledd → ogledd (o ogledd Cymru).
c000095,"Soft, Contact",Preposition,o,cymorth,noun-masc,Fe ddylai hynny fod o,i’r teulu.,gymorth,SM,o softens c→g: cymorth → gymorth.
c000096,"Soft, Contact",Preposition,o,canlyniad,noun-masc,O,", penderfynwyd cau’r ffordd.",ganlyniad,SM,Fixed phrase: o ganlyniad ‘as a result’ (c→g).
c000097,"Soft, Contact",Preposition,o,popeth,noun-masc,Rydyn ni’n dysgu o,bob dydd.,bopeth,SM,o softens p→b: popeth → bopeth.
c000098,"Soft, Contact",Preposition,am,munud,noun-masc,Aros am,", plis.",funud,SM,am commonly causes SM on m→f: munud → funud.
c000099,"Soft, Contact",Preposition,o,mater,noun-masc,Roedd yn achos o,personol.,fater,SM,o causes Soft Mutation on the next word: m→f (mater → fater).
c000100,"Soft, Contact",Preposition,o,cefndir,noun-masc,Daw hi o,gwledig.,gefndir,SM,o softens c→g (cefndir → gefndir).
c000101,"Soft, Contact",Preposition,am,dyfodol,noun-masc,Rydyn ni’n ymgyrchu am,gwell.,ddyfodol,SM,am often causes SM: d→dd (dyfodol → ddyfodol).
c000102,"Soft, Contact",Preposition,o,tir,noun-masc,Prynwyd darn o,fferm.,dir,SM,o softens t→d (tir → dir).
c000103,"Soft, Contact",Preposition,o,gweinidog,noun-masc,Daeth y neges o,heddiw.,weinidog,SM,"With g-, SM deletes the g: g→∅ (gweinidog → weinidog)."
c000104,"Soft, Contact",Preposition,am,tywydd,noun-masc,Mae pawb yn siarad am,gwael.,dywydd,SM,am softens t→d (tywydd → dywydd).
c000105,"Soft, Contact",Preposition,ar,cadair,noun-fem,Roedd y ci’n eistedd ar,ger y ffenest.,gadair,SM,ar directly before a noun triggers SM: c→g (cadair → gadair).
c000106,"Soft, Contact",Preposition,am,bachgen,noun-masc,Siaradon ni am,neithiwr wrth y drws.,fachgen,SM,am softens b→f (bachgen → fachgen).
c000107,"Soft, Contact",Preposition,at,tad,noun-masc,Anfonodd y ferch lun at,ar WhatsApp.,dad,SM,at causes SM: t→d (tad → dad).
c000108,"Soft, Contact",Preposition,dan,pont,noun-fem,Byddaf yn aros o dan,yfory.,bont,SM,dan causes SM: p→b (pont → bont).
c000109,"Soft, Contact",Preposition,dros,mis,noun-masc,Bydd y siop ar gau dros,nesaf.,fis,SM,dros causes SM: m→f (mis → fis).
c000110,"Soft, Contact",Preposition,am,gardd,noun-fem,Roedden ni’n siarad am,ar y bws bore ’ma.,ardd,SM,am + g-deletion under SM: g→∅ (gardd → ardd).
c000111,"Soft, Contact",Preposition,at,merch,noun-fem,Aeth y neges at,yn syth ar ôl y cyfarfod.,ferch,SM,at causes SM: m→f (merch → ferch).
c000112,"Soft, Contact",Preposition,ar,llyfr,noun-masc,Cadwodd hi’r nodyn ar,drwy’r wythnos i gyd.,lyfr,SM,ar causes SM; ll→l (llyfr → lyfr).
c000113,"Soft, Contact",Preposition,dros,rhwyd,noun-fem,Taflodd y bêl dros,yn hawdd ac yn uchel.,rwyd,SM,dros causes SM; rh→r (rhwyd → rwyd).
c000114,None,Preposition,am,siop,noun-fem,Roedden nhw’n holi am,newydd yn y dref.,siop,NONE,Initial s- is immune to SM: no change (siop).
c000115,None,Preposition,at,Mererid,name,Anfonwch y gwahoddiad at,erbyn dydd Gwener.,Mererid,NONE,Personal names are usually left unmutated after prepositions.
c000116,None,Preposition,dan,drws,noun-masc,Gadawodd hi’r mat dan y,drwy’r haf.,drws,NONE,"The article y intervenes, so the preposition isn’t in contact → no mutation."
c000117,None,Preposition,dros,amser,noun-masc,Mae’r casgliad wedi tyfu dros,yn araf ers y llynedd.,amser,NONE,Vowel-initial noun shows no visible SM.
c000118,None,Preposition,am,Berlin,placename,Roedden ni’n siarad am,rhaglen ddoe.,Berlin,NONE,Non-Welsh place names are usually not mutated after prepositions.
c000119,None,Preposition,ar,bwrdd,noun-masc,Rhowch y llythyr ar y gadair neu’r,ger y ffenest.,bwrdd,NONE,Intervening neu’r breaks contact → no mutation.
c000120,"Soft, Contact",Article,y,gardd,noun-fem,Gadawodd hi’r peli yn yr,ar ôl y parti.,ardd,SM,Fem. sg. noun after the definite article soft-mutates; g drops: gardd → ardd.
c000121,"Soft, Contact",Preposition,gan,plant,noun-masc,Cawson ni anogaeth gan,cyn y perfformiad.,blant,SM,gan causes SM: p→b (plant → blant).
c000122,"Soft, Contact",Preposition,heb,bwyd,noun-masc,Aethon nhw am awr heb,", ond roedd dŵr ganddyn nhw.",fwyd,SM,heb causes SM: b→f (bwyd → fwyd).
c000123,"Soft, Contact",Preposition,hyd,diwedd,noun-masc,Bydd y siop yn aros ar agor hyd,y mis.,ddiwedd,SM,hyd causes SM: d→dd (diwedd → ddiwedd).
c000124,"Soft, Contact",Preposition,i,dinas,noun-fem,Aethon ni i,brynhawn Sadwrn.,ddinas,SM,i causes SM: d→dd (dinas → ddinas).
c000125,"Soft, Contact",Preposition,o,gardd,noun-fem,Cymerodd y bachgen luniau o,ger y tŷ.,ardd,SM,o + g-deletion under SM: gardd → ardd.
c000126,"Soft, Contact",Preposition,tan,mis,noun-masc,Bydd y gwaith yn parhau tan,Tachwedd.,fis,SM,tan causes SM: m→f (mis → fis).
c000127,"Soft, Contact",Preposition,trwy,rhew,noun-masc,Cerddon ni trwy,i gyrraedd y car.,rew,SM,trwy causes SM; rh→r (rhew → rew).
c000128,"Soft, Contact",Preposition,wrth,desg,noun-fem,Roedd y llythyr yn aros wrth,y swyddfa ers ddoe.,ddesg,SM,wrth causes SM: d→dd (desg → ddesg).
c000129,"Soft, Contact",Preposition,gan,canu,verb-noun,Aeth y criw rownd y neuadd gan,yn uchel.,ganu,SM,Verb-noun after gan soft-mutates: c→g (canu → ganu).
c000130,"Soft, Contact",Preposition,wrth,gweiddi,verb-noun,Fe ddaeth y ci ataf wrth,ar y stryd.,weiddi,SM,Verb-noun after wrth soft-mutates; g drops: g→∅ (gweiddi → weiddi).
c000131,"Soft, Contact",Preposition,o,plant,noun-masc,Wnaethoch chi glywed sŵn o,ar y maes?,blant,SM,o causes SM: p→b (plant → blant).
c000132,"Soft, Contact",Preposition,hyd,llwybr,noun-masc,Cerddon ni hyd,cul i’r ffynnon.,lwybr,SM,hyd causes SM; ll→l (llwybr → lwybr).
c000133,"Soft, Contact",Preposition,heb,dŵr,noun-masc,Rydym wedi bod heb,ers tri diwrnod.,ddŵr,SM,heb causes SM: d→dd (dŵr → ddŵr).
c000134,"Soft, Contact",Preposition,wrth,rhiant,noun-masc,Roedd y plentyn yn sefyll wrth,y bachgen.,riant,SM,wrth causes SM; rh→r (rhiant → riant).
c000135,None,Preposition,gan,Mererid,name,Cawson ni e-bost gan,ddoe.,Mererid,NONE,Personal names normally remain unmutated after prepositions.
c000136,None,Preposition,heb,clawr,noun-masc,Roedd y bagiau heb y,ar ôl y tân.,clawr,NONE,"Article y blocks contact, so no mutation."
c000137,None,Preposition,hyd,yfory,day,Bydd y ffeiriau’n parhau hyd,os bydd y tywydd yn caniatáu.,yfory,NONE,Vowel-initial word: no visible SM.
c000138,None,Preposition,i,Berlin,placename,Es i i,ar gyfer y gynhadledd.,Berlin,NONE,Non-Welsh place names typically don’t mutate after prepositions.
c000139,None,Preposition,o,cadair,noun-fem,Tynnodd e’r siaced o’r,cyn eistedd.,cadair,NONE,o’r (o+yr) breaks contact → no mutation.
c000140,None,Preposition,tan,diwedd,noun-masc,Arhoswch tan y,nes bod pawb yn barod.,diwedd,NONE,Article y after the preposition blocks contact mutation.
c000141,None,Preposition,drwy,drws,noun-masc,Edrychon ni drwy’r,ar ôl y sŵn.,drws,NONE,Intervening ’r means no direct contact → no mutation.
c000142,None,Preposition,wrth,siop,noun-fem,Aroson nhw wrth,ar y gornel.,siop,NONE,Initial s- is immutable under SM.
c000143,None,Preposition,rhag,torri,verb-noun,Ceisiwch atal y plant rhag,y ffenestri.,torri,NONE,rhag does not trigger contact mutation; VN stays radical.
c000144,None,Preposition,rhwng,plant,noun-masc,Cafwyd trafodaeth onest rhwng,a’r athrawon.,plant,NONE,rhwng does not cause contact mutation.
c000145,None,Preposition,mewn,tŷ,noun-masc,Roedden nhw’n byw mewn,bach ar y bryn.,tŷ,NONE,mewn (unspecific ‘in’) does not cause mutation.
c000146,None,Preposition,ar ôl,cawod,noun-fem,Ar ôl,aeth pawb adref.,cawod,NONE,Compound preposition ar ôl does not mutate the following noun.
c000147,None,Preposition,ar draws,pont,noun-fem,Cerddon ni ar draws,i’r orsaf.,pont,NONE,Compound preposition → no mutation.
c000148,None,Preposition,ar gyfer,prosiect,noun-masc,Mae’r arian ar gyfer,lleol.,prosiect,NONE,Compound preposition → no mutation.
c000149,None,Preposition,ar bwys,bwrdd,noun-masc,Gadawodd hi'r allweddi ar bwys,yn y gegin,bwrdd,NONE,Compound preposition → no mutation.
c000150,None,Preposition,er mwyn,cefnogi,verb-noun,Fe drefnwyd y digwyddiad er mwyn,yr elusen,cefnogi,NONE,Compound preposition → no mutation.
c000151,None,Preposition,o amgylch,parc,noun-masc,Rhedon nhw o amgylch,ddwywaith,parc,NONE,Compound preposition → no mutation.
c000152,None,Preposition,o flaen,tŷ,noun-masc,Mae'r fan o flaen,ar hyn o bryd,tŷ,NONE,Compound preposition → no mutation.
c000153,None,Preposition,o gwmpas,tân,noun-masc,Roeddwn nhw'n canu o gwmpas,nos Wener,tân,NONE,Compound preposition → no mutation.
c000154,None,Preposition,wrth ymyl,tŵr,noun-masc,Mae'r orsaf wrth ymyl,.,tŵr,NONE,Compound preposition → no mutation.
c000155,None,Preposition,wrth ochr,car,noun-masc,Eisteddodd e wrth ochr,i aros,car,NONE,Compound preposition → no mutation.
c000156,None,Preposition,ymhlith,myfyrwyr,noun-masc,Mae hi'n boblogaidd ymhlith,lleol.,myfyrwyr,NONE,Compound preposition → no mutation.
c000157,None,Preposition,ymysg,gwleidyddion,noun-masc,Cafodd y syniad ei drafod ymysg,ledled y wlad,gwleidyddion,NONE,Compound preposition → no mutation.
c000158,None,Preposition,yn lle,coffi,noun-masc,Prynodd hi de yn lle,.,coffi,NONE,Compound preposition → no mutation.
c000159,"Soft, Contact",Relative,a,torrodd,verb,Dyma'r ffenest a,neithiwr.,dorrodd,SM,Relative particle “a” soft-mutates the following finite verb.
c000160,"Soft, Contact",Particle,mi,gwelais,verb,Mi,y plant ddoe,welais,SM,Affirmative particle “mi” causes SM on the following finite verb.
c000161,"Soft, Contact",Particle,fe,daw,verb,Fe,e yfory.,ddaw,SM,“fe” causes SM on the following finite verb.
c000162,"Soft, Contact",Presentative,dyma,plentyn,noun-masc,Dyma,sy'n galw arnat ti,blentyn,SM,Presentative “dyma” soft-mutates the next word.
c000163,"Soft, Contact",Presentative,dyna,car,noun-masc,Dyna,gafodd ei werth ddoe,gar,SM,“dyna” triggers SM: car→gar.
c000164,"Soft, Contact",Presentative,dacw,dyn,noun-masc,Dacw,yn cerdded dros y cae,ddyn,SM,“dacw” triggers SM: dyn→ddyn.
c000165,"Soft, Contact",Deictic,(y)ma,merch,noun-fem,"Ma,",yn aros gyda ni.,ferch,SM,Deictic “(y)ma” triggers SM: merch→ferch.
c000166,"Soft, Contact",Deictic,na,dyn,noun-masc,Mae 'na,yn aros amdani,ddyn,SM,“(y)na/’na” triggers SM: dyn→ddyn.
c000167,"Soft, Contact",Intensifier,mor,teg,adj,Mor,yw'r pris.,deg,SM,“mor” soft-mutates the following adjective (except ll/rh).
c000168,"Soft, Contact",Intensifier,go,clir,adj,Go,oedd y neges.,glir,SM,“go” causes SM: clir→glir.
c000169,"Soft, Contact",Intensifier,pur,mawr,adj,Pur,yw'r broblem,fawr,SM,“pur” causes SM: mawr→fawr.
c000170,"Soft, Contact",Intensifier,rhy,drud,adj,Rhy,yw'r tocyn,ddrud,SM,“rhy” causes SM: drud→ddrud.
c000171,"Soft, Contact",Possessive,dy,tad,noun-masc,Dw i'n aros am dy,heno.,dad,SM,Possessive “dy” triggers SM on the following noun.
c000172,"Soft, Contact",Possessive,ei (his),papur,noun-masc,Collodd e ei,yn y parc.,bapur,SM,“ei (his)” triggers SM on the following noun.
c000173,"Soft, Contact",Interrogative,pa,drws,noun-masc,Pa,sy'n well?,ddrws,SM,Interrogative “pa…?” triggers SM on the following noun.
c000174,None,Conjunction,neu,ffenestr,noun-fem,Drws neu,oedd ar agor?,ffenestr,NONE,Here “ffenestr” cannot mutate; no visible change.
c000175,"Soft, Contact",Conjunction,neu,drws,noun-masc,Wnei di agor ffenestr neu,?,ddrws,SM,Conjunction “neu” can trigger SM on the following word in this pattern.
c000176,"Soft, Contact",Numerals,ddau,ci,noun-masc,Gwelais i ddau,mawr yn y parc,gi,SM,“dau” triggers SM on a following masc. noun (ci→gi).
c000177,"Soft, Contact",Numerals,dwy,cegin,noun-fem,Mae dwy,yn y fflat,gegin,SM,“dwy” triggers SM on a following fem. noun (cegin→gegin).
c000178,"Soft, Contact",Numerals,un,cadair,noun-fem,Cymerwch un,at y bwrdd,gadair,SM,“un” before a fem. noun causes SM (not with ll/rh).
c000179,None,Numerals,un,llyfr,noun-masc,Dw i eisiau un,nawr plîs,llyfr,NONE,No contact mutation with “un” + masculine noun.
