CardId,RuleFamily,RuleCategory,Trigger,Base,WordCategory,Before,After,Answer,Outcome,Why
c000795,"Aspirate, Contact",Preposition,â,talu,verb-noun,Peidiwch â,ar y safle.,thalu,AM,"Add â and you get aspirate mutation (t→th): Peidiwch â thalu. It’s â that causes the change, not ‘Peidiwch’."
c000796,"Soft, Contact",Preposition,ar,dechrau,noun-masc,Mae cyfarfod ar,’r wythnos.,ddechrau,SM,"ar softens the following time noun. Dechrau is masculine, so d→dd gives ar ddechrau’r wythnos. The apostrophe + r is just the article and does not block this."
c000797,"Soft, Contact",Preposition,ar,dechrau,noun-masc,Cawn ni ddatganiad ar,’r mis nesaf.,ddechrau,SM,"In time phrases, ar causes soft mutation on the next noun. Dechrau (masc) becomes ddechrau."
c000798,"Soft, Contact",Preposition,ar,diwedd,noun-masc,Bydd taliad ar,y mis.,ddiwedd,SM,ar triggers soft mutation on diwedd (masc). d→dd gives ar ddiwedd y mis.
c000799,"Soft, Contact",Preposition,ar,diwedd,noun-masc,Trafodwn ni hyn ar,yr wythnos.,ddiwedd,SM,"Again, ar softens diwedd (masc) to ddiwedd. The article belongs to the NP and does not stop the softening."
c000800,"Soft, Contact",Preposition,ar,canol,noun-masc,Roedden nhw’n cwrdd ar,dydd.,ganol,SM,ar softens canol (masc) to ganol in the fixed time phrase ar ganol dydd.
c000801,"Soft, Contact",Preposition,ar,canol,noun-masc,Roedden ni allan ar,nos.,ganol,SM,Time phrase ar ganol nos takes soft mutation: c→g on canol (masc).
c000802,"Soft, Contact",Preposition,ar,bore,noun-masc,Cychwynnwn ni ar,Llun.,fore,SM,ar softens bore (masc) to fore (b→f) in ar fore Llun.
c000803,"Soft, Contact",Preposition,ar,prynhawn,noun-masc,Mae’r gêm ar,Sadwrn.,brynhawn,SM,ar softens prynhawn (masc) to brynhawn (p→b) in ar brynhawn Sadwrn.
c000804,"Soft, Contact",Preposition,ar,toriad,noun-masc,Cawn ni gwrdd ar,y wawr.,doriad,SM,ar softens toriad (masc) to doriad (t→d) in the time phrase ar doriad y wawr.
c000805,"Soft, Contact",Preposition,ar,troad,noun-masc,Cyhoeddir y canlyniadau ar,y flwyddyn.,droad,SM,ar softens troad (masc) to droad (t→d) in ar droad y flwyddyn.
c000806,"Soft, Contact",Preposition,tan,dechrau,noun-masc,Arhoswn ni tan,’r tymor.,ddechrau,SM,tan ‘until’ softens the following time noun. Dechrau (masc) becomes ddechrau.
c000807,"Soft, Contact",Preposition,tan,diwedd,noun-masc,Bydd y gwaith yn parhau tan,y flwyddyn.,ddiwedd,SM,tan triggers soft mutation on diwedd (masc) to give tan ddiwedd y flwyddyn.
c000808,"Soft, Contact",Preposition,tan,canol,noun-masc,Ar gau tan,y mis.,ganol,SM,tan softens canol (masc) to ganol in tan ganol y mis.
c000809,"Soft, Contact",Preposition,hyd,diwedd,noun-masc,Mae’r tocynnau’n ddilys hyd,y chwarter.,ddiwedd,SM,hyd ‘up to’ softens the next noun. Diwedd (masc) becomes ddiwedd.
c000810,"Soft, Contact",Preposition,hyd,dechrau,noun-masc,Cawn ni ddisgwyl hyd,’r gwanwyn.,ddechrau,SM,hyd softens dechrau (masc) to ddechrau in hyd ddechrau’r gwanwyn.
c000811,"Soft, Contact",Preposition,hyd,canol,noun-masc,Bydd hi’n gynnes hyd,yr haf.,ganol,SM,hyd softens canol (masc) to ganol in hyd ganol yr haf.
c000812,"Soft, Contact",Preposition,at,dechrau,noun-masc,Anfonwch y papurau at,’r wythnos.,ddechrau,SM,at ‘by/towards’ softens the following time noun. Dechrau (masc) → ddechrau.
c000813,"Soft, Contact",Preposition,at,diwedd,noun-masc,Rhaid i ni orffen at,yr wythnos.,ddiwedd,SM,at softens diwedd (masc) to ddiwedd in a deadline time phrase.
c000814,"Soft, Contact",Preposition,at,canol,noun-masc,Bydd y canlyniadau at,y mis.,ganol,SM,at softens canol (masc) to ganol in at ganol y mis.
c000815,"Soft, Contact",Preposition,o,bore,noun-masc,Byddwn ni yma o,Llun tan nos Wener.,fore,SM,o softens bore (masc) to fore (b→f) in o fore Llun.
c000816,"Soft, Contact",Preposition,o,prynhawn,noun-masc,Mae’r siop ar agor o,Sadwrn tan brynhawn Sul.,brynhawn,SM,o softens prynhawn (masc) to brynhawn (p→b) in o brynhawn Sadwrn.
c000817,"Soft, Contact",Preposition,dros,penwythnos,noun-masc,Bydd y ffordd ar gau dros,.,benwythnos,SM,dros ‘over’ softens penwythnos (masc) to benwythnos (p→b): a common time phrase.
c000818,"Soft, Contact",TimeExpressions,noson,Mawrth,day,Cawn ni gyfarfod Noson,", yn y ganolfan.",Fawrth,SM,"With Noson + day, the day name softens where possible. Mawrth softens to Fawrth."
c000819,"Soft, Contact",TimeExpressions,noson,Mercher,day,Gig fach Noson,", dewch draw.",Fercher,SM,Noson causes soft mutation on the day name. Mercher softens to Fercher.
c000820,"Soft, Contact",TimeExpressions,noson,Gwener,day,Cinio teulu Noson,", am saith.",Wener,SM,"Noson triggers g- loss on Gwener, giving Wener."
c000821,"Soft, Contact",Preposition,ar,dechrau,noun-masc,Trefnwn ni hyfforddiant ar,’r tymor newydd.,ddechrau,SM,"One more core pattern for calendars: ar softens dechrau (masc) to ddechrau. Use it across week, month, term and year phrases."
c000822,"Soft, Contact",Determiner,llawer,cais,noun-masc,Cawsom llawer o,yr wythnos hon.,gais,SM,Quantifier + o softens the next word: c→g (cais → gais).
c000823,None,Determiner,ychydig,amynedd,noun-masc,Mae gen i ychydig o,ar ôl y dydd hir.,amynedd,NONE,"Quantifier frame present, but vowels don’t show soft mutation (amynedd starts with a vowel)."
c000824,None,Determiner,mwy,syniadau,noun-pl,Mae angen mwy o,ar gyfer y prosiect.,syniadau,NONE,mwy o doesn’t change s- (s is immutable in Soft Mutation).
c000825,"Soft, Contact",Determiner,llai,pwysau,noun-masc,Rydw i eisiau llai o,arnaf i erbyn y gwanwyn.,bwysau,SM,llai o triggers SM on the following word: p→b (pwysau → bwysau).
c000826,"Soft, Contact",Determiner,digon,buddion,noun-pl,Mae digon o,i wneud i’r cynllun werth chweil.,fuddion,SM,digon o causes SM: b→f (buddion → fuddion).
c000827,"Soft, Contact",Determiner,llawer,ceisiadau,noun-pl,Daeth llawer o,dîm y gogledd ddoe.,geisiadau,SM,llawer o softens c→g (ceisiadau → geisiadau).
c000828,"Soft, Contact",Determiner,ychydig,pethau,noun-pl,Mae ganddyn nhw ychydig o,i’w cwblhau eto.,bethau,SM,ychydig o causes SM: p→b (pethau → bethau).
c000829,"Soft, Contact",Determiner,mwy,cyfleoedd,noun-pl,Rydym am greu mwy o,i siarad Cymraeg.,gyfleoedd,SM,mwy o softens c→g (cyfleoedd → gyfleoedd).
c000830,"Soft, Contact",Determiner,llai,traffig,noun-masc,Gobeithiwn am llai o,yn y boreau.,draffig,SM,llai o causes SM: t→d (traffig → draffig).
c000831,None,Determiner,digon,ffrwythau,noun-pl,Mae digon o,yn y fasged eisoes.,ffrwythau,NONE,"ff doesn’t change under SM, so no visible effect."
c000832,None,Determiner,rhywfaint,enwau,noun-pl,Mae rhywfaint o,ar y rhestr eisoes.,enwau,NONE,Vowel-initial nouns don’t show SM changes after o.
c000833,None,Determiner,tipyn,newid,noun-masc,Gwnaethon nhw tipyn o,yn y rheolau llynedd.,newid,NONE,n- doesn’t soften in SM; stays radical.
c000834,"Soft, Contact",Determiner,llawer,cydweithrediad,noun-masc,Mae angen llawer o,rhwng yr adrannau.,gydweithrediad,SM,llawer o causes SM: c→g (cydweithrediad → gydweithrediad).
c000835,"Soft, Contact",Determiner,ychydig,blychau,noun-pl,Mae ganddo ychydig o,yn y storfa.,flychau,SM,ychydig o softens b→f (blychau → flychau).
c000836,"Soft, Contact",Determiner,mwy,cyflogau,noun-pl,Byddai mwy o,yn denu mwy o ymgeiswyr.,gyflogau,SM,mwy o causes SM: c→g (cyflogau → gyflogau).
c000837,"Soft, Contact",Determiner,llai,bryder,noun-masc,Hoffwn weld llai o,yn y gweithle.,fryder,SM,llai o causes SM: b→f (bryder → fryder).
c000838,"Soft, Contact",Determiner,digon,cennin,noun-pl,Mae digon o,ar y farchnad heddiw.,gennin,SM,digon o causes SM: c→g (cennin → gennin).
c000839,"Soft, Contact",Determiner,llawer,cathod,noun-pl,Clywsom llawer o,yn y stryd neithiwr.,gathod,SM,llawer o causes SM: c→g (cathod → gathod).
c000840,"Soft, Contact",Determiner,ychydig,manteision,noun-pl,Roedd ychydig o,i’w gweld ar unwaith.,fanteision,SM,ychydig o causes SM: m→f (manteision → fanteision).
c000841,"Soft, Contact",Determiner,mwy,dewisiadau,noun-pl,Mae mwy o,ar gael ar-lein erbyn hyn.,ddewisiadau,SM,mwy o softens d→dd (dewisiadau → ddewisiadau).
c000842,"Soft, Contact",Determiner,llai,dyluniadau,noun-pl,Bydd llai o,’n cyrraedd yr wythnos nesaf.,ddyluniadau,SM,llai o causes SM: d→dd (dyluniadau → ddyluniadau).
c000843,"Soft, Contact",Determiner,digon,gwesteion,noun-pl,Roedd digon o,yn y digwyddiad ffurfiol.,westeion,SM,digon o causes SM: g disappears (gwesteion → westeion).
c000844,"Soft, Contact",Determiner,tipyn,gwres,noun-masc,Cafwyd tipyn o,yn y neuadd heno.,wres,SM,tipyn o causes SM: g disappears (gwres → wres).
c000845,"Soft, Contact",Determiner,rhywfaint,rhesymau,noun-pl,Mae rhywfaint o,drosbwyll i fod yn ofalus.,resymau,SM,rhywfaint o causes SM: rh→r (rhesymau → resymau).
c000846,None,Determiner,llawer,ymatebion,noun-pl,Cawsom llawer o,drwy’r ffurflen.,ymatebion,NONE,Vowel-initial nouns don’t show a change under SM after o.
c000847,"Soft, Contact",Interrogative,pa,drws,noun-masc,Pa,sy'n agored heno?,ddrws,SM,"Pa (‘which’) comes before a noun and makes it start softer. Here the noun is masculine: d→dd, so drws → ddrws."
c000848,"Soft, Contact",Interrogative,pa,ci,noun-masc,Pa,wyt ti'n ei ddewis?,gi,SM,"Pa causes softening on the noun that follows. This noun is masculine: c→g, so ci → gi."
c000849,"Soft, Contact",Interrogative,pa,cath,noun-fem,Pa,sy'n well gyda phlant?,gath,SM,"Pa softens the following noun. Feminine noun here: c→g, so cath → gath."
c000850,"Soft, Contact",Interrogative,pa,merch,noun-fem,Pa,a gyrhaeddodd gyntaf?,ferch,SM,"Pa triggers soft mutation on the noun. Feminine noun: m→f, so merch → ferch."
c000851,"Soft, Contact",Interrogative,pa,dyn,noun-masc,Pa,wnaeth ofyn y cwestiwn?,ddyn,SM,"Pa causes the soft start. Masculine noun: d→dd, so dyn → ddyn."
c000852,"Soft, Contact",Interrogative,pa,plentyn,noun-masc,Pa,sy'n berchen ar y bag glas?,blentyn,SM,"Pa softens the next noun. Masculine noun: p→b, so plentyn → blentyn."
c000853,"Soft, Contact",Interrogative,pa,cadair,noun-fem,Pa,hoffet ti eistedd arni?,gadair,SM,"Pa triggers soft mutation. Feminine noun: c→g, so cadair → gadair."
c000854,"Soft, Contact",Interrogative,pa,tŷ,noun-masc,Pa,yw rhif saith?,dŷ,SM,"Pa causes softening. Masculine noun: t→d, so tŷ → dŷ."
c000855,"Soft, Contact",Interrogative,pa,rhan,noun-fem,Pa,o'r ffilm oedd orau?,ran,SM,"Pa softens the following noun. Feminine noun starting rh- goes to r-, so rhan → ran."
c000856,"Soft, Contact",Interrogative,pa,llyfr,noun-masc,Pa,wnest ti ei orffen ddoe?,lyfr,SM,Pa softens ll→l. Masculine noun: llyfr → lyfr.
c000857,"Soft, Contact",Interrogative,pa,gair,noun-masc,Pa,wyt ti'n chwilio amdano?,air,SM,Pa softens by dropping initial g-. Masculine noun: gair → air.
c000858,"Soft, Contact",Interrogative,pa,pobl,noun-pl,Pa,sy'n aros tu allan?,bobl,SM,"Pa softens the next noun. Plural pobl softens p→b, so pobl → bobl."
c000859,"Soft, Contact",Interrogative,pa,problem,noun-fem,Pa,ddylem ni ei datrys gyntaf?,broblem,SM,"Pa triggers softening. Feminine noun: p→b, so problem → broblem."
c000860,None,Interrogative,pa,ysgol,noun-fem,Pa,wyt ti'n ei ffafrio?,ysgol,NONE,"Pa is present, but the noun starts with a vowel, so there is no visible change. The noun is feminine."
c000861,None,Interrogative,pa,stori,noun-fem,Pa,hoffet ti ei darllen?,stori,NONE,"Pa does not change s- in soft mutation. The noun is feminine, but s is immutable, so no change."
c000862,"Soft, Contact",Interrogative,mor,drud,adj,Pa mor,yw'r tocyn?,ddrud,SM,"In the question frame Pa mor + adjective, the adjective starts softer. d→dd, so drud → ddrud."
c000863,"Soft, Contact",Interrogative,mor,clir,adj,Pa mor,oedd yr esboniad?,glir,SM,"Pa mor causes the adjective to soften. c→g, so clir → glir."
c000864,"Soft, Contact",Interrogative,mor,mawr,adj,Pa mor,yw'r broblem?,fawr,SM,"Pa mor softens m→f, so mawr → fawr."
c000865,"Soft, Contact",Interrogative,mor,tew,adj,Pa mor,yw'r papur?,dew,SM,"Pa mor triggers soft mutation t→d, so tew → dew."
c000866,"Soft, Contact",Interrogative,mor,clyd,adj,Pa mor,yw'r ystafell?,glyd,SM,"Pa mor softens c→g, so clyd → glyd."
c000867,None,Interrogative,mor,rhad,adj,Pa mor,yw'r pris?,rhad,NONE,"In Pa mor + adjective, rh- does not show a change. rhad stays the same."
c000868,"Soft, Contact",Interrogative,a,daw,verb,A,e heno?,ddaw,SM,"Question particle A (formal/literary) makes the following finite verb start softer. d→dd, so daw → ddaw. This is not the conjunction a ‘and’."
c000869,"Soft, Contact",Interrogative,a,torrodd,verb,A,hi'r rheol?,dorrodd,SM,"A softens the verb that follows. t→d, so torrodd → dorrodd."
c000870,"Soft, Contact",Interrogative,a,prynodd,verb,A,e'r tocyn ddoe?,brynodd,SM,"A causes soft mutation on the finite verb. p→b, so prynodd → brynodd."
c000871,"Soft, Contact",Interrogative,a,gwelwch,verb,A,chi'r arwydd?,welwch,SM,A softens g- away at the start of a verb. gwelwch → welwch. Use this in formal questions.
c000872,None,Interrogative,a,oes,verb,A,ddigon o amser?,oes,NONE,"A is present, but the verb is vowel-initial, so there is no visible softening. The form is simply A oes ...? in formal questions."
c000873,"Soft, Contact",Article,r,blwyddyn,noun-fem,Dw i'n cofio'r,hon yn dda.,flwyddyn,SM,"Because blwyddyn is a feminine singular noun, it soft-mutates after the definite article: b changes to f ('r flwyddyn)."
c000874,"Soft, Contact",Article,r,merch,noun-fem,Mae'r,yn aros tu allan.,ferch,SM,"Because merch is a feminine singular noun, it soft-mutates after the definite article: m changes to f ('r ferch)."
c000875,"Soft, Contact",Article,r,mam,noun-fem,Mae'r,ar y ffôn.,fam,SM,"Because mam is a feminine singular noun, it soft-mutates after the definite article: m changes to f ('r fam)."
c000876,"Soft, Contact",Article,y,taith,noun-fem,Roedd y,"yn flinedig, ond yn braf.",daith,SM,"Because taith is a feminine singular noun, it soft-mutates after the definite article: t changes to d (y daith)."
c000877,"Soft, Contact",Article,r,cerddoriaeth,noun-fem,Dw i'n hoffi'r,yn fawr.,gerddoriaeth,SM,"Because cerddoriaeth is a feminine singular noun, it soft-mutates after the definite article: c changes to g ('r gerddoriaeth)."
c000878,"Soft, Contact",Article,r,cyfres,noun-fem,Wyt ti'n gwylio'r,newydd?,gyfres,SM,"Because cyfres is a feminine singular noun, it soft-mutates after the definite article: c changes to g ('r gyfres)."
c000879,"Soft, Contact",Article,r,cymdeithas,noun-fem,Mae'r,yn newid yn gyflym.,gymdeithas,SM,"Because cymdeithas is a feminine singular noun, it soft-mutates after the definite article: c changes to g ('r gymdeithas)."
c000880,"Soft, Contact",Article,r,cymuned,noun-fem,Mae'r,yn helpu pawb.,gymuned,SM,"Because cymuned is a feminine singular noun, it soft-mutates after the definite article: c changes to g ('r gymuned)."
c000881,"Soft, Contact",Article,r,canolfan,noun-fem,Dw i'n mynd i'r,bob wythnos.,ganolfan,SM,"Because canolfan is a feminine singular noun, it soft-mutates after the definite article: c changes to g (i'r ganolfan)."
c000882,"Soft, Contact",Article,y,cân,noun-fem,Gwranda ar y,eto.,gân,SM,"Because cân is a feminine singular noun, it soft-mutates after the definite article: c changes to g (y gân)."
c000883,"Soft, Contact",Article,r,cerdd,noun-fem,Clywais i'r,ar y radio.,gerdd,SM,"Because cerdd is a feminine singular noun, it soft-mutates after the definite article: c changes to g (i'r gerdd)."
c000884,"Soft, Contact",Article,r,cyfraith,noun-fem,Mae'r,yn glir.,gyfraith,SM,"Because cyfraith is a feminine singular noun, it soft-mutates after the definite article: c changes to g ('r gyfraith)."
c000885,"Soft, Contact",Article,r,dadl,noun-fem,Mae'r,yn parhau.,ddadl,SM,"Because dadl is a feminine singular noun, it soft-mutates after the definite article: d changes to dd ('r ddadl)."
c000886,"Soft, Contact",Article,y,dinas,noun-fem,Dw i'n adnabod y,yn dda.,ddinas,SM,"Because dinas is a feminine singular noun, it soft-mutates after the definite article: d changes to dd (y ddinas)."
c000887,"Soft, Contact",Article,y,deddf,noun-fem,Bydd y,yn newid yn fuan.,ddeddf,SM,"Because deddf is a feminine singular noun, it soft-mutates after the definite article: d changes to dd (y ddeddf)."
c000888,"Soft, Contact",Article,r,menyw,noun-fem,Gwelais i'r,yn y siop.,fenyw,SM,"Because menyw is a feminine singular noun, it soft-mutates after the definite article: m changes to f (i'r fenyw)."
c000889,"Soft, Contact",Article,r,problem,noun-fem,Dyna'r,eto.,broblem,SM,"Because problem is a feminine singular noun, it soft-mutates after the definite article: p changes to b ('r broblem)."
c000890,"Soft, Contact",Article,r,pont,noun-fem,Mae'r,dros yr afon.,bont,SM,"Because pont is a feminine singular noun, it soft-mutates after the definite article: p changes to b ('r bont)."
c000891,None,Article,r,rhan,noun-fem,Dw i'n deall y,gyntaf ond nid yr ail.,rhan,NONE,"Rhan is feminine, but it begins with rh-, and feminine nouns beginning with rh- do not soft-mutate after the definite article (y rhan)."
c000892,None,Article,r,llywodraeth,noun-fem,Mae'r,wedi gwneud penderfyniad.,llywodraeth,NONE,"Llywodraeth is feminine, but it begins with ll-, and feminine nouns beginning with ll- do not soft-mutate after the definite article ('r llywodraeth)."
c000893,None,Article,r,llaw,noun-fem,Mae'r,yn boenus heddiw.,llaw,NONE,"Llaw is feminine, but it begins with ll-, and feminine nouns beginning with ll- do not soft-mutate after the definite article ('r llaw)."
c000894,None,Article,r,ysgol,noun-fem,Dw i'n mynd i'r,bore 'ma.,ysgol,NONE,"Ysgol begins with a vowel sound, and vowels don't mutate; the definite article form is 'r/yr (i'r ysgol)."
c000895,None,Article,yr,ardal,noun-fem,Dw i'n byw yn yr,hon.,ardal,NONE,"Ardal begins with a vowel, so it can't mutate; the definite article is yr before a vowel (yn yr ardal)."
c000896,None,Article,y,stori,noun-fem,Dw i wedi darllen y,eisoes.,stori,NONE,"Stori is feminine, but it begins with s-, and s doesn't change in soft mutation, so it stays the same after the definite article (y stori)."
c000897,None,Article,y,gwaith,noun-masc,Dw i yn y,heddiw.,gwaith,NONE,"Gwaith is masculine, so it does not change after the definite article (y gwaith)."
c000898,None,Article,r,plentyn,noun-masc,Mae'r,yn chwerthin.,plentyn,NONE,"Plentyn is masculine, so it does not change after the definite article ('r plentyn)."
c000899,None,Article,r,tŷ,noun-masc,Mae'r,yn lân.,tŷ,NONE,"Tŷ is masculine, so it does not change after the definite article ('r tŷ)."
c000900,None,Article,r,pen,noun-masc,Mae'r,yn brifo.,pen,NONE,"Pen is masculine, so it does not change after the definite article ('r pen)."
c000901,None,Article,r,bwyd,noun-masc,Mae'r,yn barod.,bwyd,NONE,"Bwyd is masculine, so it does not change after the definite article ('r bwyd)."
c000902,None,Article,r,diwedd,noun-masc,Mae'r,yn nesáu.,diwedd,NONE,"Diwedd is masculine, so it does not change after the definite article ('r diwedd)."
c000903,None,Article,r,dechrau,noun-masc,Dyma'r,felly paid â stopio nawr.,dechrau,NONE,"Dechrau is masculine, so it does not change after the definite article ('r dechrau)."
c000904,None,Article,r,cynllun,noun-masc,Mae'r,yn gweithio.,cynllun,NONE,"Cynllun is masculine, so it does not change after the definite article ('r cynllun)."
c000905,None,Article,r,cyngor,noun-masc,Gofynnais i'r,am help.,cyngor,NONE,"Cyngor is masculine, so it does not change after the definite article (i'r cyngor)."
c000906,None,Article,r,cig,noun-masc,Dw i'n prynu'r,yn aml.,cig,NONE,"Cig is masculine, so it does not change after the definite article ('r cig)."
c000907,None,Article,r,cwmni,noun-masc,Mae'r,yn tyfu.,cwmni,NONE,"Cwmni is masculine, so it does not change after the definite article ('r cwmni)."
c000908,None,Article,r,llyfr,noun-masc,Mae'r,ar y bwrdd.,llyfr,NONE,"Llyfr is masculine, so it does not change after the definite article ('r llyfr)."
c000909,None,Article,y,llun,noun-masc,Wyt ti wedi gweld y,?,llun,NONE,"Llun is masculine, so it does not change after the definite article (y llun)."
c000910,None,Article,r,mis,noun-masc,Mae'r,yma'n brysur.,mis,NONE,"Mis is masculine, so it does not change after the definite article ('r mis)."
c000911,None,Article,yr,amser,noun-masc,Does gen i ddim yr,heddiw.,amser,NONE,"Amser is masculine, so it does not change after the definite article. It also begins with a vowel, so the article form is yr (yr amser)."
c000912,None,Article,r,tîm,noun-masc,Mae'r,yn ennill.,tîm,NONE,"Tîm is masculine, so it does not change after the definite article ('r tîm)."
c000913,"Soft, Contact",Article,r,tref,noun-fem,Mae'r,yn dawel heno.,dref,SM,"After 'the' (y/'r/yr), feminine singular nouns take a soft mutation, so 'tref' becomes 'dref'."
c000914,"Soft, Contact",Article,y,tref,noun-fem,Dw i'n adnabod y,yn dda.,dref,SM,"After 'the' (y/'r/yr), feminine singular nouns take a soft mutation, so 'tref' becomes 'dref'."
c000915,"Soft, Contact",Article,y,tafarn,noun-fem,Roedd y,ar gau neithiwr.,dafarn,SM,"After 'the' (y/'r/yr), feminine singular nouns take a soft mutation, so 'tafarn' becomes 'dafarn'."
c000916,"Soft, Contact",Article,r,trafodaeth,noun-fem,Mae'r,wedi dechrau eisoes.,drafodaeth,SM,"After 'the' (y/'r/yr), feminine singular nouns take a soft mutation, so 'trafodaeth' becomes 'drafodaeth'."
c000917,"Soft, Contact",Article,r,trafodaeth,noun-fem,Dyna'r,am y cynllun newydd.,drafodaeth,SM,"After 'the' (y/'r/yr), feminine singular nouns take a soft mutation, so 'trafodaeth' becomes 'drafodaeth'."
c000918,"Soft, Contact",Article,r,deiseb,noun-fem,Darllenais i'r,yn ofalus.,ddeiseb,SM,"After 'the' (y/'r/yr), feminine singular nouns take a soft mutation, so 'deiseb' becomes 'ddeiseb'."
c000919,"Soft, Contact",Article,y,deiseb,noun-fem,Llofnodais y,ddoe.,ddeiseb,SM,"After 'the' (y/'r/yr), feminine singular nouns take a soft mutation, so 'deiseb' becomes 'ddeiseb'."
c000920,"Soft, Contact",Article,r,gwraig,noun-fem,Gwelais i'r,ddoe.,wraig,SM,"After 'the' (y/'r/yr), feminine singular nouns take a soft mutation, so 'gwraig' becomes 'wraig'."
c000921,"Soft, Contact",Article,r,gwraig,noun-fem,Mae'r,yn gweithio yma.,wraig,SM,"After 'the' (y/'r/yr), feminine singular nouns take a soft mutation, so 'gwraig' becomes 'wraig'."
c000922,None,Article,y,rhaglen,noun-fem,Roedd y,ar y teledu neithiwr.,rhaglen,NONE,"This is a feminine singular noun, but words starting with 'rh' do not soften after the definite article."
c000923,None,Article,r,llinell,noun-fem,Mae'r,ar y map yn anghywir.,llinell,NONE,"This is a feminine singular noun, but words starting with 'll' do not soften after the definite article."
c000924,None,Article,r,swyddfa,noun-fem,Mae'r,ar gau heddiw.,swyddfa,NONE,"This is a feminine singular noun, so the soft-mutation rule applies, but 's' doesn't change in soft mutation."
c000925,None,Article,yr,ystafell,noun-fem,Yr,yma yw'r un fwyaf.,ystafell,NONE,"This is a feminine singular noun, but it begins with a vowel sound, so there is no visible change after the article."
c000926,"Soft, Contact",Article,r,gwybodaeth,noun-fem,Mae'r,yn ddefnyddiol iawn.,wybodaeth,SM,"After 'the' (y/'r/yr), feminine singular nouns take a soft mutation, so 'gwybodaeth' becomes 'wybodaeth'."
c000927,"Soft, Contact",Article,r,gwybodaeth,noun-fem,Dyma'r,ar y wefan.,wybodaeth,SM,"After 'the' (y/'r/yr), feminine singular nouns take a soft mutation, so 'gwybodaeth' becomes 'wybodaeth'."
c000928,None,Article,r,cyfnod,noun-masc,Mae'r,yn anodd i bawb.,cyfnod,NONE,"With the definite article, only feminine singular nouns soften. This noun is masculine, so it stays the same."
c000929,None,Article,r,rheswm,noun-masc,Dyna'r,dros y penderfyniad.,rheswm,NONE,"With the definite article, only feminine singular nouns soften. This noun is masculine, so it stays the same."
c000930,None,Article,r,cwestiwn,noun-masc,Mae'r,yn dal heb ateb.,cwestiwn,NONE,"With the definite article, only feminine singular nouns soften. This noun is masculine, so it stays the same."
c000931,None,Article,r,canlyniad,noun-masc,Mae'r,yn glir erbyn hyn.,canlyniad,NONE,"With the definite article, only feminine singular nouns soften. This noun is masculine, so it stays the same."
c000932,None,Article,r,cofnod,noun-masc,Darllenais i'r,ddwywaith.,cofnod,NONE,"With the definite article, only feminine singular nouns soften. This noun is masculine, so it stays the same."
c000933,None,Article,r,busnes,noun-masc,Mae'r,yn tyfu'n gyflym.,busnes,NONE,"With the definite article, only feminine singular nouns soften. This noun is masculine, so it stays the same."
c000934,None,Article,y,polisi,noun-masc,Dwi ddim yn deall y,weithiau.,polisi,NONE,"With the definite article, only feminine singular nouns soften. This noun is masculine, so it stays the same."
c000935,None,Article,r,teulu,noun-masc,Mae'r,yn dod dros y penwythnos.,teulu,NONE,"With the definite article, only feminine singular nouns soften. This noun is masculine, so it stays the same."
c000936,None,Article,r,arian,noun-masc,Ble mae'r,?,arian,NONE,"With the definite article, only feminine singular nouns soften. This noun is masculine, so it stays the same."
c000937,None,Article,r,tywydd,noun-masc,Mae'r,yn newid yn sydyn.,tywydd,NONE,"With the definite article, only feminine singular nouns soften. This noun is masculine, so it stays the same."
c000938,None,Article,r,cymorth,noun-masc,Mae'r,ar gael i bawb.,cymorth,NONE,"With the definite article, only feminine singular nouns soften. This noun is masculine, so it stays the same."
c000939,None,Article,r,croeso,noun-masc,Cawson ni'r,gorau yno.,croeso,NONE,"With the definite article, only feminine singular nouns soften. This noun is masculine, so it stays the same."
c000940,None,Article,r,cylch,noun-masc,Mae'r,yn cau am chwech.,cylch,NONE,"With the definite article, only feminine singular nouns soften. This noun is masculine, so it stays the same."
